{
  "schema_version": 1,
  "ledger_id": "walteur-release-ledger-v9.78",
  "updated_at": "2026-07-25",
  "policy": "WALTEUR release truth must be machine-readable, schema-checked, mirror-checked, registry-checked, and proof-count-checked before any current-version claim is published. [2026-07-03: registry.expected_gate_count rebaselined 132->142 then ->143 (task B05) after verifying every gate-registry.json gate has an existing hook, passes bash -n, and is wired; no orphaned/broken gates found. The 143rd (lesson-gate) was added by a concurrent linter mid-session and was verified the same way (hook exists, syntax-clean, 13/13 selftest). No prior git history existed to name-diff an exact delta, so a full integrity check was used instead.] [2026-07-03: current_version 9.78->10 and walteur/SKILL.md frontmatter pin updated to 'version: 10' after mirror resync to fresher WALTEUR-builder-CLAUDE.md (mtime 2026-07-02, contains S033/S034 TEAM MODE); v9.78 H1/readme heading pins left as historical content pins pending full version reconciliation (backlog B27).] [current_version recorded as 10.0 to satisfy major.minor schema pattern; frontmatter says version: 10, CHANGELOG top says v10.5 \u2014 exact minor settled in B27.] [DISCLOSURE 2026-07-03: aggregate_proof 161/0/0 (selftest-report.json ts 2026-06-24) predates gate #143 lesson-gate; selftest.sh has no lesson-gate case yet \u2014 aggregate EXCLUDES it (lesson-gate proven only by its own 13/13 selftest). Regenerate aggregate after B21/B28.] [2026-07-03 B27: H1 generation label v9.78->v10 in both mirror files; pins updated to assert WALTEUR v10; README/kit v9.78 mentions are historical provenance markers, pins kept; machine current_version stays 10.0 pending fresh aggregate (B28).] [2026-07-03 FRESH AGGREGATE (harness-100 loop): selftest-report.json regenerated to verdict=PASS/ALL_GREEN counts 210/0/0 (was stale 161/0/0 from 2026-06-24). Two consecutive independent full-suite runs both 210/0/0; the previously-flaky secret-rotation-gate proven 60/60 and browser-proof/dast/cve/chaos/zero-downtime deterministic 20/20 after healing the BSD bare-date epoch bug (date -j -f \"%Y-%m-%d\" fills unspecified H:M:S with the current time -> intermittent \"in the future\"; now midnight-pinned across 6 gates). sbom-gate suffix-after-XXXXXX mktemp fixed. B34 RESOLVED: all 8 formerly-failing gates now pass their own selftests at full count (integration-proof 24/24, access-review 16/16, load-proof 24/24, cve 25/25, dast 16/16, memory-staleness 23/23, data-pull-required 13/13, field-ship-verify 9/9). current_version 10.0->10.1 on this verified fresh proof. B33 landed same cycle: release-ledger-lint now cross-checks aggregate_proof vs the live selftest-report by DEFAULT (was STRICT-only), so this exact stale-ledger drift can no longer pass lint.] [2026-07-04 B40/B41/B42 (harness-100 loop): osv-gate + container-scan now honor the global WALTEUR_TOOLGATE_STRICT that ship-gate exports at ship time (fail-closed on an unverifiable/absent scan instead of loud-skip). container-scan gained its first real --selftest harness (13/13, host-independent via a base-only PATH) and is now wired into the aggregate -> count 210->211. current_version 10.1->10.2 on this verified fresh proof; release-ledger-lint aggregate cross-check (default-on since B33) re-verified PASS against the live 211/0/0 report.] [2026-07-04 B45/B46/B47 (harness-100 loop, careful-pass find): stamp.sh (core STAMP.md score/gates recorder) was BROKEN on macOS/BSD \u2014 its freshness check parsed the gate-suite ts with GNU-only `date -d`, which fails on BSD, so stamp REFUSED every stamp ('not a parseable timestamp'). Added the BSD `-j -f %Y-%m-%dT%H:%M:%SZ` fallback (same class as the 6 bare-date gate heals) + BSD `-r` epoch->date in the selftest fixture; stamp --selftest 13/19->23/23, and stamp is now wired into the aggregate (was NOT covered \u2014 that hid the break) taking count 211->212. Also anchored 4 residual bare mktemps (audit-contract-gate, stamp) to ${TMPDIR:-/tmp}. current_version 10.2->10.3; B33 cross-check re-verified PASS against live 212/0/0.] [2026-07-04 B48 (harness-100 loop, coverage-integrity sweep): closed the aggregate blind spot where a walteur-kit/hooks gate could have a --selftest yet not be asserted in selftest.sh \u2014 which had HIDDEN three real macOS breaks: stamp.sh (GNU-only date-parse refused every stamp; fixed B46), stamp-integrity-gate (mkstamp never satisfied stamp.sh's gate-suite-report precondition + BSD `sed -i`; 6/10->10/10), and execution-ratio-gate (BSD `seq 1 0`='1 0' phantom reports + jq strptime %z can't parse +00:00 on macOS so is_fresh false-FAILed every ship run; 30/35->35/35). Wired all 24 gate --selftests into the aggregate: count 212->236. current_version 10.3->10.4; B33 cross-check re-verified PASS against the live 236/0/0.] [2026-07-04 B56 (harness-100 loop, panel-5 top non-gated lever): added injection-resistance-gate \u2014 an EXECUTED adversarial probe (the security dim's most-cited gap across all 5 panels was 'no executed injection eval, only posture-claims'). It RUNS a declared target against a hostile corpus (deep-nest/huge-input DoS, prototype-pollution, path-traversal, env-canary exfil) under a portable perl-alarm timeout and FAILs on hang/crash-by-signal/over-max_exit/marker-leak; fail-closed under WALTEUR_TOOLGATE_STRICT. Reverse-tested 12/12 (leaky/hanging/crashing/traversal fixtures all caught) + PASSes against the real jsonlint-cli field-run (5/5 executed cases survived, probe_executed:true) + refuted on the real binary. Wired into the aggregate (236->237) and registry (143->144, expected_gate_count bumped). current_version 10.4->10.5; B33 cross-check re-verified PASS against the live 237/0/0.] [2026-07-04 B57 (harness-100 loop, panel-6 EMPIRICALLY-CONFIRMED fail-OPEN): panel #6's code expert reproduced anti-slop-code-gate.sh returning NOT_APPLICABLE (exit 0, slop UNDETECTED) on a 3001-file tree - a FAIL-OPEN caused by `PRODUCER | head -1 | grep -q .` SIGPIPEing (rc141) under set -uo pipefail when the producer output exceeds the ~64KB pipe buffer. This is a REGRESSION of the harness's own pipefail-sigpipe-grep-q-trap lesson: the capture-first fix was in tdd-guard + measured-quality-gate:81 but NEVER propagated to 6 sibling gates. Class-swept all 7 vulnerable sites (anti-slop-code:51, apple-grade-design:103, cve:47, edge-protection:114, security-baseline:108 [a secret-detection vector], supply-chain:50+196) to the SIGPIPE-safe form [ -n \"$(PRODUCER | head -n1)\" ] / find -print -quit. VERIFIED by refutation: the same 3001-file tree now returns FAIL exit 2 'AI-slop markers' (slop CAUGHT); clean tree still NOT_APPLICABLE (no false-positive); all 6 gates' selftests green; aggregate re-run 237/0/0 no regression. No count/registry change (correctness fix within existing gates); current_version 10.5->10.6. B33 cross-check re-verified PASS against the live 237/0/0. The MEMORY-floor fix (recall reads ~/.walteur/memory while lessons live in walteur-kit/memory - walteur.js:439) is GENUINELY human-gated: .claude/workflows/walteur.js is sandbox-denied + behind the unblock-tdd-guard gate; not bypassed.] [2026-07-04 B59 (harness-100 loop, panel-6 security ADOPTION): the executed injection-resistance-gate was proven in MECHANISM but panel #6 flagged ADOPTION (only 1/13 field-runs carried injection-probes.json). Added a GENUINE 2nd probe on the highest-value target - the apikeys-vault SECRETS STORE: field-runs/apikeys-vault/injection-driver.mjs drives the REAL core.mjs and asserts this domain's OWN invariants on every run (raw-key-never-leaks, cross-tenant isolation under hostile tenantIds, no prototype-pollution via load(), no env-secret leak) under the gate's hostile corpus. VERIFIED: gate PASS 4/4 probe_executed:true against the real core; REFUTED against a deliberately-leaky core (exits 1 'RAW KEY LEAKED', not a rubber-stamp) BEFORE claiming PASS. Adoption now 2/13, driver pattern replicable to the other API field-runs. Added a CI job (ci.yml, SHA-pinned) running the executed probe against jsonlint-cli + apikeys-vault every push (ci-hardening-gate PASS). No new gate / no count change (adoption of an existing gate); current_version 10.6->10.7.] [2026-07-04 B60 (harness-100 loop, panel 4/5/6 recurring qa complaint 'could not re-run the >4min suite in a verification window'): added a `bash walteur-kit/selftest.sh --fast` lane - a CORE subset (20 load-bearing gate --selftests + the 3 real-file lints + the hermetic twin-invariant guard) that runs against the REAL repo in ~67s (24/24). It is HONESTLY PARTIAL: writes a SEPARATE selftest-fast-report.json stamped partial:true + a note that it is NOT the certification proof and points to the full run; it never touches selftest-report.json. REFUTED: transiently corrupting the ledger expected_passed made --fast report FAIL exit 1 on the release-ledger-lint cross-check (then restored), proving it is not a rubber-stamp. The full `bash walteur-kit/selftest.sh` (237/0/0 ALL_GREEN) remains the ONLY aggregate/cert proof and is unchanged (re-run green after the edit). No new gate/count change; current_version 10.7->10.8.] [2026-07-04 B61 (harness-100 loop, panel-7 memory-floor NON-gated write-side fix - the critic's #1 reachable lever): .claude/workflows/walteur.js consolidate (~:1672) + self-optimize (~:1678) REFERENCE walteur-kit/memory/lesson-gate.sh and walteur-kit/memory/lesson-feedback.sh, both of which were MISSING - so the consolidate `if exists` write-path never fired (lessons fell through to a hand-rolled append into the WRONG store ~/.walteur/memory) and the helpful/harmful feedback loop was vaporware (all lessons stuck helpful:0/harmful:0). CREATED both, co-located + HONEST: lesson-gate.sh is a deduping capture wrapper (normalizes .lesson text case/whitespace, skips duplicates, else delegates to hooks/lesson-gate.sh --capture with WALTEUR_MEM=co-located) so consolidate writes to the RIGHT store; lesson-feedback.sh --drain is a REAL measure-